{
 "app_version": "0.09.001",
 "arms_that_failed_to_fit": {},
 "artifact": {
  "bytes": 82292,
  "format": "json",
  "path": "real-enusa/case.json"
 },
 "case_id": "real-enusa",
 "category": "real-campaign",
 "controls": {},
 "digest": "b59dda0eb7800ae7d86abaa89f7214325b744dc247f398f089633ab634090803",
 "engine": {
  "package": "blastfrag",
  "version": "0.04.000"
 },
 "expected_band": {
  "en": "coarse, 0.26 to 0.64 m measured",
  "es": "gruesa, 0,26 a 0,64 m medidos"
 },
 "flags": [],
 "gate": {
  "lane": "live",
  "pure_python": true,
  "reasons": [],
  "run_ms_budget": 1500.0,
  "trace_bytes": 82292,
  "trace_bytes_budget": 262144,
  "wheels": [
   "numpy"
  ]
 },
 "held_out_site": "Enusa",
 "lane": "live",
 "models_scope": "Enusa",
 "n_scoreable": 12,
 "n_training_rows": 85,
 "provenance": {
  "corpus_digest": "9a72094d641a2557be4f22a100f4103d466dfbfe3830172dcf4e631979c56073",
  "dataset": "train",
  "doi": "10.1002/nag.957",
  "licence": "numeric facts from Hudaverdi, Kulatilake and Kuzu 2010, doi:10.1002/nag.957",
  "n_blasts": 12,
  "real_or_synthetic": "real",
  "site": "Enusa"
 },
 "real_or_synthetic": "real",
 "schema": "fragmenta.manifest/v1",
 "seed": 0
}