{
 "app_version": "0.09.004",
 "arms_that_failed_to_fit": {},
 "artifact": {
  "bytes": 73495,
  "format": "json",
  "path": "real-dongri-buzurg/case.json"
 },
 "case_id": "real-dongri-buzurg",
 "category": "real-campaign",
 "controls": {},
 "digest": "66cf16db816d77f9c57753b56625b2cd1f1e1a991ea17562619244bbb8d6855a",
 "engine": {
  "package": "blastfrag",
  "version": "0.04.000"
 },
 "expected_band": {
  "en": "medium, 0.23 to 0.76 m measured",
  "es": "media, 0,23 a 0,76 m medidos"
 },
 "flags": [],
 "gate": {
  "lane": "live",
  "pure_python": true,
  "reasons": [],
  "run_ms_budget": 1500.0,
  "trace_bytes": 73495,
  "trace_bytes_budget": 262144,
  "wheels": [
   "numpy"
  ]
 },
 "held_out_site": "Dongri-Buzurg",
 "lane": "live",
 "models_scope": "Dongri-Buzurg",
 "n_scoreable": 9,
 "n_training_rows": 88,
 "provenance": {
  "corpus_digest": "9a72094d641a2557be4f22a100f4103d466dfbfe3830172dcf4e631979c56073",
  "dataset": "train",
  "doi": "10.1002/nag.957",
  "licence": "numeric facts from Hudaverdi, Kulatilake and Kuzu 2010, doi:10.1002/nag.957",
  "n_blasts": 9,
  "real_or_synthetic": "real",
  "site": "Dongri-Buzurg"
 },
 "real_or_synthetic": "real",
 "schema": "fragmenta.manifest/v1",
 "seed": 0
}