{
 "app_version": "0.10.000",
 "arms_that_failed_to_fit": {},
 "artifact": {
  "bytes": 76978,
  "format": "json",
  "path": "synth-ibsd-capped/case.json"
 },
 "case_id": "synth-ibsd-capped",
 "category": "structural-control",
 "controls": {},
 "digest": "43a7a77574d3ac87a54ecf9ea250dff882f4d90f8ebdb097c35aba248524a4d2",
 "engine": {
  "package": "blastfrag",
  "version": "0.04.000"
 },
 "expected_band": {
  "en": "coarse tail dominated by the block size, not by the powder factor",
  "es": "cola gruesa dominada por el tama\u00f1o de bloque, no por el factor de carga"
 },
 "flags": [],
 "gate": {
  "lane": "live",
  "pure_python": true,
  "reasons": [],
  "run_ms_budget": 1500.0,
  "trace_bytes": 76978,
  "trace_bytes_budget": 262144,
  "wheels": [
   "numpy"
  ]
 },
 "held_out_site": null,
 "lane": "live",
 "models_scope": "corpus",
 "n_scoreable": 0,
 "n_training_rows": 97,
 "provenance": {
  "corpus_digest": null,
  "dataset": "synthetic",
  "doi": "",
  "licence": "generated by this product; no measured data",
  "n_blasts": 12,
  "real_or_synthetic": "synthetic",
  "site": null
 },
 "real_or_synthetic": "synthetic",
 "schema": "fragmenta.manifest/v1",
 "seed": 0
}