{
 "app_version": "0.09.004",
 "arms_that_failed_to_fit": {},
 "artifact": {
  "bytes": 66746,
  "format": "json",
  "path": "real-soma/case.json"
 },
 "case_id": "real-soma",
 "category": "real-campaign",
 "controls": {},
 "digest": "34aaea6e55a06f36e4a1ccb0007d6d9b7f78bd6fea27a61918273aaa05c4646a",
 "engine": {
  "package": "blastfrag",
  "version": "0.04.000"
 },
 "expected_band": {
  "en": "fine, 0.15 to 0.28 m measured",
  "es": "fina, 0,15 a 0,28 m medidos"
 },
 "flags": [],
 "gate": {
  "lane": "live",
  "pure_python": true,
  "reasons": [],
  "run_ms_budget": 1500.0,
  "trace_bytes": 66746,
  "trace_bytes_budget": 262144,
  "wheels": [
   "numpy"
  ]
 },
 "held_out_site": "Soma",
 "lane": "live",
 "models_scope": "Soma",
 "n_scoreable": 7,
 "n_training_rows": 90,
 "provenance": {
  "corpus_digest": "9a72094d641a2557be4f22a100f4103d466dfbfe3830172dcf4e631979c56073",
  "dataset": "train",
  "doi": "10.1002/nag.957",
  "licence": "numeric facts from Hudaverdi, Kulatilake and Kuzu 2010, doi:10.1002/nag.957",
  "n_blasts": 7,
  "real_or_synthetic": "real",
  "site": "Soma"
 },
 "real_or_synthetic": "real",
 "schema": "fragmenta.manifest/v1",
 "seed": 0
}