{
 "app_version": "0.08.000",
 "arms_that_failed_to_fit": {},
 "artifact": {
  "bytes": 62309,
  "format": "json",
  "path": "ctrl-degenerate/case.json"
 },
 "case_id": "ctrl-degenerate",
 "category": "negative-control",
 "controls": {
  "degenerate_negative_control": {
   "answered_by": [],
   "n_answered_anyway": 0,
   "n_degenerate": 6,
   "passed": true
  }
 },
 "digest": "fe01dfb0edd76fd9afe96c90e3ae093f6ebc65401aef70b73088245ae5fd3556",
 "engine": {
  "package": "blastfrag",
  "version": "0.04.000"
 },
 "expected_band": {
  "en": "every arm abstains, with a reason",
  "es": "todo brazo se abstiene, con una raz\u00f3n"
 },
 "flags": [
  {
   "blast_id": "DG01",
   "detail": "the stemming is 4.60 burdens in a bench 1.40 burdens tall, so there is no charge column. This is not a blast.",
   "kind": "degenerate-design"
  },
  {
   "blast_id": "DG02",
   "detail": "the stemming is 4.60 burdens in a bench 1.40 burdens tall, so there is no charge column. This is not a blast.",
   "kind": "degenerate-design"
  },
  {
   "blast_id": "DG03",
   "detail": "the stemming is 4.60 burdens in a bench 1.40 burdens tall, so there is no charge column. This is not a blast.",
   "kind": "degenerate-design"
  },
  {
   "blast_id": "DG04",
   "detail": "the stemming is 4.60 burdens in a bench 1.40 burdens tall, so there is no charge column. This is not a blast.",
   "kind": "degenerate-design"
  },
  {
   "blast_id": "DG05",
   "detail": "the stemming is 4.60 burdens in a bench 1.40 burdens tall, so there is no charge column. This is not a blast.",
   "kind": "degenerate-design"
  },
  {
   "blast_id": "DG06",
   "detail": "the stemming is 4.60 burdens in a bench 1.40 burdens tall, so there is no charge column. This is not a blast.",
   "kind": "degenerate-design"
  }
 ],
 "gate": {
  "lane": "live",
  "pure_python": true,
  "reasons": [],
  "run_ms_budget": 1500.0,
  "trace_bytes": 62309,
  "trace_bytes_budget": 262144,
  "wheels": [
   "numpy"
  ]
 },
 "held_out_site": null,
 "lane": "live",
 "models_scope": "corpus",
 "n_scoreable": 0,
 "n_training_rows": 97,
 "provenance": {
  "corpus_digest": null,
  "dataset": "synthetic",
  "doi": "",
  "licence": "generated by this product; no measured data",
  "n_blasts": 6,
  "real_or_synthetic": "synthetic",
  "site": null
 },
 "real_or_synthetic": "synthetic",
 "schema": "fragmenta.manifest/v1",
 "seed": 0
}