{
 "app_version": "0.10.000",
 "arms_that_failed_to_fit": {},
 "artifact": {
  "bytes": 72103,
  "format": "json",
  "path": "synth-sweep-burden/case.json"
 },
 "case_id": "synth-sweep-burden",
 "category": "parameter-sweep",
 "controls": {},
 "digest": "c048c6b34032815b475cd8abfdb2da3830a35ce99f0ed725e0c09ee10259b76e",
 "engine": {
  "package": "blastfrag",
  "version": "0.04.000"
 },
 "expected_band": {
  "en": "monotonic: coarser as the burden widens",
  "es": "mon\u00f3tona: m\u00e1s gruesa a medida que el bordo se ampl\u00eda"
 },
 "flags": [],
 "gate": {
  "lane": "live",
  "pure_python": true,
  "reasons": [],
  "run_ms_budget": 1500.0,
  "trace_bytes": 72103,
  "trace_bytes_budget": 262144,
  "wheels": [
   "numpy"
  ]
 },
 "held_out_site": null,
 "lane": "live",
 "models_scope": "corpus",
 "n_scoreable": 0,
 "n_training_rows": 97,
 "provenance": {
  "corpus_digest": null,
  "dataset": "synthetic",
  "doi": "",
  "licence": "generated by this product; no measured data",
  "n_blasts": 12,
  "real_or_synthetic": "synthetic",
  "site": null
 },
 "real_or_synthetic": "synthetic",
 "schema": "fragmenta.manifest/v1",
 "seed": 0
}