{
 "app_version": "0.09.004",
 "arms_that_failed_to_fit": {},
 "artifact": {
  "bytes": 114629,
  "format": "json",
  "path": "real-akdaglar/case.json"
 },
 "case_id": "real-akdaglar",
 "category": "real-campaign",
 "controls": {},
 "digest": "2dc47e91698ab0d2c3111774b05339c52c7abedd3e67f763e3c21e36d1da66fa",
 "engine": {
  "package": "blastfrag",
  "version": "0.04.000"
 },
 "expected_band": {
  "en": "fine, 0.14 to 0.22 m measured",
  "es": "fina, 0,14 a 0,22 m medidos"
 },
 "flags": [],
 "gate": {
  "lane": "live",
  "pure_python": true,
  "reasons": [],
  "run_ms_budget": 1500.0,
  "trace_bytes": 114629,
  "trace_bytes_budget": 262144,
  "wheels": [
   "numpy"
  ]
 },
 "held_out_site": "Akdaglar",
 "lane": "live",
 "models_scope": "Akdaglar",
 "n_scoreable": 22,
 "n_training_rows": 75,
 "provenance": {
  "corpus_digest": "9a72094d641a2557be4f22a100f4103d466dfbfe3830172dcf4e631979c56073",
  "dataset": "train",
  "doi": "10.1002/nag.957",
  "licence": "numeric facts from Hudaverdi, Kulatilake and Kuzu 2010, doi:10.1002/nag.957",
  "n_blasts": 22,
  "real_or_synthetic": "real",
  "site": "Akdaglar"
 },
 "real_or_synthetic": "real",
 "schema": "fragmenta.manifest/v1",
 "seed": 0
}