{
 "app_version": "0.08.001",
 "arms_that_failed_to_fit": {},
 "artifact": {
  "bytes": 69165,
  "format": "json",
  "path": "ctrl-oracle/case.json"
 },
 "case_id": "ctrl-oracle",
 "category": "positive-control",
 "controls": {
  "positive_control": {
   "max_abs_error_m": 0.0,
   "n_checked": 8,
   "passed": true
  }
 },
 "digest": "f8afa1933fe2d11484076a7a3d5d1213c6145b0348be9e426bb8895930946894",
 "engine": {
  "package": "blastfrag",
  "version": "0.04.000"
 },
 "expected_band": {
  "en": "the generating arm recovers its own truth to within 1e-9",
  "es": "el brazo generador recupera su propia verdad dentro de 1e-9"
 },
 "flags": [],
 "gate": {
  "lane": "live",
  "pure_python": true,
  "reasons": [],
  "run_ms_budget": 1500.0,
  "trace_bytes": 69165,
  "trace_bytes_budget": 262144,
  "wheels": [
   "numpy"
  ]
 },
 "held_out_site": null,
 "lane": "live",
 "models_scope": "corpus",
 "n_scoreable": 8,
 "n_training_rows": 97,
 "provenance": {
  "corpus_digest": null,
  "dataset": "synthetic",
  "doi": "",
  "licence": "generated by this product; no measured data",
  "n_blasts": 8,
  "real_or_synthetic": "synthetic",
  "site": null
 },
 "real_or_synthetic": "synthetic",
 "schema": "fragmenta.manifest/v1",
 "seed": 0
}