{
 "app_version": "0.07.000",
 "arms_that_failed_to_fit": {},
 "artifact": {
  "bytes": 74911,
  "format": "json",
  "path": "synth-sweep-powder/case.json"
 },
 "case_id": "synth-sweep-powder",
 "category": "parameter-sweep",
 "controls": {},
 "digest": "ebf8bb9beba4f9271dc8f720587e1d021992c6f55db06f620a72e9e61168e32b",
 "engine": {
  "package": "blastfrag",
  "version": "0.04.000"
 },
 "expected_band": {
  "en": "monotonic: finer as the powder factor rises",
  "es": "mon\u00f3tona: m\u00e1s fina a medida que sube el factor de carga"
 },
 "flags": [],
 "gate": {
  "lane": "live",
  "pure_python": true,
  "reasons": [],
  "run_ms_budget": 1500.0,
  "trace_bytes": 74911,
  "trace_bytes_budget": 262144,
  "wheels": [
   "numpy"
  ]
 },
 "held_out_site": null,
 "lane": "live",
 "models_scope": "corpus",
 "n_scoreable": 0,
 "n_training_rows": 97,
 "provenance": {
  "corpus_digest": null,
  "dataset": "synthetic",
  "doi": "",
  "licence": "generated by this product; no measured data",
  "n_blasts": 12,
  "real_or_synthetic": "synthetic",
  "site": null
 },
 "real_or_synthetic": "synthetic",
 "schema": "fragmenta.manifest/v1",
 "seed": 0
}