{
 "app_version": "0.07.000",
 "arms_that_failed_to_fit": {},
 "artifact": {
  "bytes": 54903,
  "format": "json",
  "path": "fx01-fixture/case.json"
 },
 "case_id": "fx01-fixture",
 "category": "real-campaign",
 "controls": {},
 "digest": "11a1dd42525f41cf480d80ec853a38dd608a3e0b79d74b9234156dc79daedaa2",
 "engine": {
  "package": "blastfrag",
  "version": "0.04.000"
 },
 "expected_band": {
  "en": "medium, 0.23 to 0.38 m measured",
  "es": "media, 0,23 a 0,38 m medidos"
 },
 "flags": [],
 "gate": {
  "lane": "live",
  "pure_python": true,
  "reasons": [],
  "run_ms_budget": 1500.0,
  "trace_bytes": 54903,
  "trace_bytes_budget": 262144,
  "wheels": [
   "numpy"
  ]
 },
 "held_out_site": "Murgul",
 "lane": "live",
 "models_scope": "Fixture",
 "n_scoreable": 3,
 "n_training_rows": 90,
 "provenance": {
  "corpus_digest": "9a72094d641a2557be4f22a100f4103d466dfbfe3830172dcf4e631979c56073",
  "dataset": "train",
  "doi": "10.1002/nag.957",
  "licence": "numeric facts from Hudaverdi, Kulatilake and Kuzu 2010, doi:10.1002/nag.957",
  "n_blasts": 3,
  "real_or_synthetic": "real",
  "site": "Murgul"
 },
 "real_or_synthetic": "real",
 "schema": "fragmenta.manifest/v1",
 "seed": 0
}