{
 "app_version": "0.09.001",
 "arms_that_failed_to_fit": {},
 "artifact": {
  "bytes": 66602,
  "format": "json",
  "path": "real-ozmert/case.json"
 },
 "case_id": "real-ozmert",
 "category": "real-campaign",
 "controls": {},
 "digest": "7af31232736b3f63a30ab17cfc0630ee38dea62dee5b6d65ecb0b147cd318978",
 "engine": {
  "package": "blastfrag",
  "version": "0.04.000"
 },
 "expected_band": {
  "en": "fine, 0.12 to 0.30 m measured",
  "es": "fina, 0,12 a 0,30 m medidos"
 },
 "flags": [],
 "gate": {
  "lane": "live",
  "pure_python": true,
  "reasons": [],
  "run_ms_budget": 1500.0,
  "trace_bytes": 66602,
  "trace_bytes_budget": 262144,
  "wheels": [
   "numpy"
  ]
 },
 "held_out_site": "Ozmert",
 "lane": "live",
 "models_scope": "Ozmert",
 "n_scoreable": 7,
 "n_training_rows": 90,
 "provenance": {
  "corpus_digest": "9a72094d641a2557be4f22a100f4103d466dfbfe3830172dcf4e631979c56073",
  "dataset": "train",
  "doi": "10.1002/nag.957",
  "licence": "numeric facts from Hudaverdi, Kulatilake and Kuzu 2010, doi:10.1002/nag.957",
  "n_blasts": 7,
  "real_or_synthetic": "real",
  "site": "Ozmert"
 },
 "real_or_synthetic": "real",
 "schema": "fragmenta.manifest/v1",
 "seed": 0
}