{
 "app_version": "0.09.000",
 "arms_that_failed_to_fit": {},
 "artifact": {
  "bytes": 52690,
  "format": "json",
  "path": "real-miami/case.json"
 },
 "case_id": "real-miami",
 "category": "negative-control",
 "controls": {
  "geometry_negative_control": {
   "n_answered_anyway": 0,
   "n_without_geometry": 6,
   "passed": true
  }
 },
 "digest": "fa0e15bb9b49247e096c2e18fcda7f8c55a68b5795712a69523a5ebc071a7896",
 "engine": {
  "package": "blastfrag",
  "version": "0.04.000"
 },
 "expected_band": {
  "en": "the classical arm abstains on all six; the ratio arms answer",
  "es": "el brazo cl\u00e1sico se abstiene en los seis; los brazos de razones responden"
 },
 "flags": [],
 "gate": {
  "lane": "live",
  "pure_python": true,
  "reasons": [],
  "run_ms_budget": 1500.0,
  "trace_bytes": 52690,
  "trace_bytes_budget": 262144,
  "wheels": [
   "numpy"
  ]
 },
 "held_out_site": "Miami",
 "lane": "live",
 "models_scope": "Miami",
 "n_scoreable": 6,
 "n_training_rows": 91,
 "provenance": {
  "corpus_digest": "9a72094d641a2557be4f22a100f4103d466dfbfe3830172dcf4e631979c56073",
  "dataset": "train",
  "doi": "10.1002/nag.957",
  "licence": "numeric facts from Hudaverdi, Kulatilake and Kuzu 2010, doi:10.1002/nag.957",
  "n_blasts": 6,
  "real_or_synthetic": "real",
  "site": "Miami"
 },
 "real_or_synthetic": "real",
 "schema": "fragmenta.manifest/v1",
 "seed": 0
}