{
 "app_version": "0.09.002",
 "arms_that_failed_to_fit": {},
 "artifact": {
  "bytes": 78940,
  "format": "json",
  "path": "real-mrica/case.json"
 },
 "case_id": "real-mrica",
 "category": "real-campaign",
 "controls": {},
 "digest": "5d0a1cd2fd6e5008d90a15149d275044b959b03d110c542fcd500da67aeb9bfb",
 "engine": {
  "package": "blastfrag",
  "version": "0.04.000"
 },
 "expected_band": {
  "en": "fine, 0.13 to 0.21 m measured",
  "es": "fina, 0,13 a 0,21 m medidos"
 },
 "flags": [],
 "gate": {
  "lane": "live",
  "pure_python": true,
  "reasons": [],
  "run_ms_budget": 1500.0,
  "trace_bytes": 78940,
  "trace_bytes_budget": 262144,
  "wheels": [
   "numpy"
  ]
 },
 "held_out_site": "Mrica",
 "lane": "live",
 "models_scope": "Mrica",
 "n_scoreable": 11,
 "n_training_rows": 86,
 "provenance": {
  "corpus_digest": "9a72094d641a2557be4f22a100f4103d466dfbfe3830172dcf4e631979c56073",
  "dataset": "train",
  "doi": "10.1002/nag.957",
  "licence": "numeric facts from Hudaverdi, Kulatilake and Kuzu 2010, doi:10.1002/nag.957",
  "n_blasts": 11,
  "real_or_synthetic": "real",
  "site": "Mrica"
 },
 "real_or_synthetic": "real",
 "schema": "fragmenta.manifest/v1",
 "seed": 0
}