{
 "app_version": "0.07.000",
 "arms_that_failed_to_fit": {},
 "artifact": {
  "bytes": 63401,
  "format": "json",
  "path": "real-reocin-ug/case.json"
 },
 "case_id": "real-reocin-ug",
 "category": "real-campaign",
 "controls": {},
 "digest": "a93c7a2d85331b3d87b8eaacd775a75062bff8dab31d16295f683137c86bfb70",
 "engine": {
  "package": "blastfrag",
  "version": "0.04.000"
 },
 "expected_band": {
  "en": "coarse, 0.51 to 0.69 m measured",
  "es": "gruesa, 0,51 a 0,69 m medidos"
 },
 "flags": [],
 "gate": {
  "lane": "live",
  "pure_python": true,
  "reasons": [],
  "run_ms_budget": 1500.0,
  "trace_bytes": 63401,
  "trace_bytes_budget": 262144,
  "wheels": [
   "numpy"
  ]
 },
 "held_out_site": "Reocin-UG",
 "lane": "live",
 "models_scope": "Reocin-UG",
 "n_scoreable": 6,
 "n_training_rows": 91,
 "provenance": {
  "corpus_digest": "9a72094d641a2557be4f22a100f4103d466dfbfe3830172dcf4e631979c56073",
  "dataset": "train",
  "doi": "10.1002/nag.957",
  "licence": "numeric facts from Hudaverdi, Kulatilake and Kuzu 2010, doi:10.1002/nag.957",
  "n_blasts": 6,
  "real_or_synthetic": "real",
  "site": "Reocin-UG"
 },
 "real_or_synthetic": "real",
 "schema": "fragmenta.manifest/v1",
 "seed": 0
}